Anão;• +4 Constituição, +2 Sabedoria, –2 Destreza.• Deslocamento 6m.• Visão no Escuro 18m.• +4 em testes de resistência contra venenos e magia.• Para anões, todos os tipos de machados e martelos são armas simples.• Classe de armadura +4 contra adversários de tamanho Grande ou maior.• +2 em testes de perícias para assuntos relacionados a pedra e metal, apenas para perícias com Inteligência ou Sabedoria como habilidade-chave.
Elfo;• +4 Destreza, +2 Inteligência, –2 Constituição.  • Visão na Penumbra. • +4 em testes de Vontade contra encantamentos. Elfos também são imunes à magia sono. • +4 em testes de Identifi car Magia e Percepção• A dificuldade do teste de resistência contra magias arcanas lançadas por um elfo aumenta em CD +2. • Elfos sabem usar espadas curtas, espadas longas, floretes e arcos (curtos, longos e compostos). Elfos também recebem Foco em Arma para uma destas armas.
Goblin;• +4 Destreza, +2 Constituição, –2 Carisma.  • Tamanho Pequeno. • Deslocamento 9m. • Visão no Escuro 18m. • +4 em testes de Fortitude contra doenças e venenos. Goblins também não precisam fazer testes de Fortitude por ingerir comida estragada. • +4 em testes de Ladinagem e Oficio (uma à escolha do jogador).
Halfling;• +4 Destreza, +2 Carisma, –2 Força. • Tamanho Pequeno. • +2 em todos os testes de resistência, por sua sorte incrível. • +1 em jogadas de ataque com armas de arremesso e fundas.  • Para halflings a perícia Atletismo é baseada em Destreza, não em Força. • +4 em testes de Enganação. Ninguém desconfia de halflings.
Humano;• +2 em duas habilidades à escolha do jogador. • 2 perícias treinadas extras. • 2 talentos adicionais à escolha do jogador.
Lefou;• +2 em duas habilidades à escolha do jogador (exceto Carisma).• Tipo Monstro.• Visão no escuro 18m.• 2 talentos da Tormenta adicionais. O lefou não perde pontos de Carisma por estes talentos (mas perde se adquirir outros).• Deformidade. Todo lefou tem algum defeito físico que, embora desagradável aos olhos, confere certa vantagem.• Afinidade com a Tormenta. Um lefou jamais recebe níveis negativos devido a efeitos causados pela Tormenta ou seus habitantes. Ele ainda pode receber níveis negativos de outras formas.
Minotauro;• +4 Força, +2 Constituição, –2 Carisma.• Classe de armadura +1.• Minotauros possuem um ataque natural de chifres (1d6, crítico x2, perfuração).• Faro.• Lógica labiríntica. Minotauros têm excelente senso de direção, e recebem +8 em testes de Sobrevivência para não se perder.• Medo de altura. Caso tenha que subir qualquer altura superior a 3m (ou se estiver a até 3m de uma queda desta altura), um minotauro sofre penalidade de –4 em suas jogadas e testes. Ele também não pode realizar nenhuma ação que dependa de concentração, como conjurar magias.
Qareen;• +4 Carisma, +2 Inteligência, –2 Sabedoria.• +4 em testes de Identificar Magia. • Desejos. Uma vez por dia, o qareen pode lançar uma magia sem pagar PM (ou sem esquecê-la), mas apenas se fizer isso quando alguém tiver lhe pedido.• Pequenos desejos. Um qareen pode lançar todos os truques (magias arcanas de nível 0).• Um qareen pode lançar a magia voo uma vez por dia.• Conforme sua descendência, um qareen tem resistência especial quanto a algum tipo de energia.
